{
  "$schema": "http://json-schema.org/draft-07/schema#",
  "type": "object",
  "properties": {
    "modulePath": {
      "type": "string",
      "minLength": 1,
      "pattern": "^(?!.*(?:^|\\/)\\.{1,2}(?:\\/|$))(?!.*[\\\\:\\u0000])[^/]+(?:\\/[^/]+)*$"
    },
    "variableRoot": {
      "type": "string",
      "minLength": 1
    },
    "variableMacros": {
      "type": "array",
      "items": {
        "type": "object",
        "properties": {
          "source": {
            "type": "string",
            "minLength": 1
          },
          "target": {
            "type": "string"
          }
        },
        "required": [
          "source",
          "target"
        ],
        "additionalProperties": false
      }
    },
    "controllerEntries": {
      "type": "array",
      "items": {
        "type": "object",
        "properties": {
          "bookId": {
            "type": "string",
            "minLength": 1
          },
          "entryId": {
            "type": "integer",
            "minimum": 0,
            "maximum": 9007199254740991
          }
        },
        "required": [
          "bookId",
          "entryId"
        ],
        "additionalProperties": false
      }
    },
    "updaterEntries": {
      "type": "array",
      "items": {
        "type": "object",
        "properties": {
          "bookId": {
            "type": "string",
            "minLength": 1
          },
          "entryId": {
            "type": "integer",
            "minimum": 0,
            "maximum": 9007199254740991
          }
        },
        "required": [
          "bookId",
          "entryId"
        ],
        "additionalProperties": false
      }
    }
  },
  "required": [
    "modulePath",
    "variableRoot",
    "variableMacros",
    "controllerEntries",
    "updaterEntries"
  ],
  "additionalProperties": false,
  "$comment": "Generated from schema.ts by scripts/generate-native-card-schemas.ts."
}
